{
  "$schema": "../../schemas/blender-toolchain.schema.json",
  "schema_version": "1.0.0",
  "id": "BLD-BLENDER-501-WINDOWS-X64",
  "version": "5.0.1",
  "build_hash": "a3db93c5b259",
  "platform": "Windows x64",
  "archive_url": "https://cdn.builder.blender.org/download/daily/blender-5.0.1-stable+v50.a3db93c5b259-windows.amd64-release.zip",
  "checksum_url": "https://cdn.builder.blender.org/download/daily/blender-5.0.1-stable+v50.a3db93c5b259-windows.amd64-release.zip.sha256",
  "published_sha256": "ed2b9dc43ecba07f0be03f8d477e30939851aa8f738a9c9f4c39f0427a3693d6",
  "verified_sha256": "ed2b9dc43ecba07f0be03f8d477e30939851aa8f738a9c9f4c39f0427a3693d6",
  "verified_at": "2026-07-20T01:00:00+00:00",
  "custody": "temporary-local",
  "notes": [
    "The archive was downloaded from Blender Foundation infrastructure and matched the published SHA-256 before extraction.",
    "The archive and executable are not committed to VirtualAuto.",
    "This record covers only the Windows x64 smoke environment."
  ]
}
